nom de la matrice : emojisSMOTE2mots
------ Chargement du dataset depuis : D:\mes programmes python\HAI817I-Machine-learning-m-thodes-classiques\src\matrices\emojisSMOTE2mots.csv
   1st  4th     EMOJI  EMOJI EMOJI  EMOJI emoji  EMOJI url  USER  USER USER  USER cause  ...  year url  yesterday  york  york city  young  youth  youtube  yrs  science_related
0  0.0  0.0  0.000000     0.000000          0.0        0.0   0.0        0.0         0.0  ...       0.0        0.0   0.0        0.0    0.0    0.0      0.0  0.0                0
1  0.0  0.0  0.810734     0.501585          0.0        0.0   0.0        0.0         0.0  ...       0.0        0.0   0.0        0.0    0.0    0.0      0.0  0.0                0
2  0.0  0.0  0.000000     0.000000          0.0        0.0   0.0        0.0         0.0  ...       0.0        0.0   0.0        0.0    0.0    0.0      0.0  0.0                1
3  0.0  0.0  0.000000     0.000000          0.0        0.0   0.0        0.0         0.0  ...       0.0        0.0   0.0        0.0    0.0    0.0      0.0  0.0                1
4  0.0  0.0  0.000000     0.000000          0.0        0.0   0.0        0.0         0.0  ...       0.0        0.0   0.0        0.0    0.0    0.0      0.0  0.0                1

[5 rows x 1765 columns]
(1530, 1765)
(1530, 1764)
(1530,)
format du jeu d'apprentissage : (1071, 1764)
format du jeu de test : (459, 1764)
Répartition des classes :
Classe 0 : 765 échantillons
Classe 1 : 765 échantillons
KFold sur SVC : accuracy moyenne : 0.8851678781585324 écart-type : 0.029505841130346308
Accuracy : 0.906318082788671
Matrice de confusion
[[214  16]
 [ 27 202]]
Classification report
              precision    recall  f1-score   support

           0       0.89      0.93      0.91       230
           1       0.93      0.88      0.90       229

    accuracy                           0.91       459
   macro avg       0.91      0.91      0.91       459
weighted avg       0.91      0.91      0.91       459

Quel classifieur choisissez-vous
:SVC
--------------------------- Optuna ---------------------------


[I 2026-05-12 14:28:09,284] A new study created in memory with name: no-name-eab3119e-a435-4f75-a360-8ae93de30627
[I 2026-05-12 14:28:17,352] Trial 0 finished with value: 0.8720886763747011 and parameters: {'C': 1, 'gamma': 0.005, 'kernel': 'linear', 'degree': 3, 'class_weight': 'balanced'}. Best is trial 0 with value: 0.8720886763747011.
[I 2026-05-12 14:28:23,937] Trial 1 finished with value: 0.5023255813953489 and parameters: {'C': 1, 'gamma': 0.005, 'kernel': 'poly', 'degree': 5, 'class_weight': None}. Best is trial 0 with value: 0.8720886763747011.
Exception ignored in: <function Image.__del__ at 0x000001AFFCC9C860>
Traceback (most recent call last):
  File "D:\Python\Lib\tkinter\__init__.py", line 4073, in __del__
    self.tk.call('image', 'delete', self.name)
RuntimeError: main thread is not in main loop
Exception ignored in: <function Variable.__del__ at 0x000001AFFCBF9C60>
Traceback (most recent call last):
  File "D:\Python\Lib\tkinter\__init__.py", line 410, in __del__
    if self._tk.getboolean(self._tk.call("info", "exists", self._name)):
                           ^^^^^^^^^^^^^^^^^^^^^^^^^^^^^^^^^^^^^^^^^^^
RuntimeError: main thread is not in main loop
Exception ignored in: <function Variable.__del__ at 0x000001AFFCBF9C60>
Traceback (most recent call last):
  File "D:\Python\Lib\tkinter\__init__.py", line 410, in __del__
    if self._tk.getboolean(self._tk.call("info", "exists", self._name)):
                           ^^^^^^^^^^^^^^^^^^^^^^^^^^^^^^^^^^^^^^^^^^^
RuntimeError: main thread is not in main loop
Exception ignored in: <function Variable.__del__ at 0x000001AFFCBF9C60>
Traceback (most recent call last):
  File "D:\Python\Lib\tkinter\__init__.py", line 410, in __del__
    if self._tk.getboolean(self._tk.call("info", "exists", self._name)):
                           ^^^^^^^^^^^^^^^^^^^^^^^^^^^^^^^^^^^^^^^^^^^
RuntimeError: main thread is not in main loop
Exception ignored in: <function Variable.__del__ at 0x000001AFFCBF9C60>
Traceback (most recent call last):
  File "D:\Python\Lib\tkinter\__init__.py", line 410, in __del__
    if self._tk.getboolean(self._tk.call("info", "exists", self._name)):
                           ^^^^^^^^^^^^^^^^^^^^^^^^^^^^^^^^^^^^^^^^^^^
RuntimeError: main thread is not in main loop
[I 2026-05-12 14:28:49,236] Trial 2 finished with value: 0.8702282112584221 and parameters: {'C': 8.5, 'gamma': 2, 'kernel': 'rbf', 'degree': 4, 'class_weight': None}. Best is trial 0 with value: 0.8720886763747011.
[I 2026-05-12 14:28:54,267] Trial 3 finished with value: 0.7144751141056292 and parameters: {'C': 7.5, 'gamma': 7, 'kernel': 'poly', 'degree': 4, 'class_weight': 'balanced'}. Best is trial 0 with value: 0.8720886763747011.
[I 2026-05-12 14:28:59,597] Trial 4 finished with value: 0.8739621821343186 and parameters: {'C': 20, 'gamma': 0.002, 'kernel': 'linear', 'degree': 5, 'class_weight': 'balanced'}. Best is trial 4 with value: 0.8739621821343186.
[I 2026-05-12 14:29:05,159] Trial 5 finished with value: 0.5023255813953489 and parameters: {'C': 8.1, 'gamma': 0.002, 'kernel': 'poly', 'degree': 5, 'class_weight': None}. Best is trial 4 with value: 0.8739621821343186.
[I 2026-05-12 14:29:10,919] Trial 6 finished with value: 0.8664985872636384 and parameters: {'C': 7.3, 'gamma': 0.002, 'kernel': 'linear', 'degree': 4, 'class_weight': 'balanced'}. Best is trial 4 with value: 0.8739621821343186.
[I 2026-05-12 14:29:16,318] Trial 7 finished with value: 0.5209302325581395 and parameters: {'C': 0.01, 'gamma': 7, 'kernel': 'linear', 'degree': 2, 'class_weight': None}. Best is trial 4 with value: 0.8739621821343186.
[I 2026-05-12 14:29:21,540] Trial 8 finished with value: 0.5032558139534884 and parameters: {'C': 1.4, 'gamma': 0.005, 'kernel': 'poly', 'degree': 3, 'class_weight': None}. Best is trial 4 with value: 0.8739621821343186.
[I 2026-05-12 14:29:25,310] Trial 9 finished with value: 0.8721017170180396 and parameters: {'C': 1.3, 'gamma': 2, 'kernel': 'linear', 'degree': 2, 'class_weight': None}. Best is trial 4 with value: 0.8739621821343186.
[I 2026-05-12 14:29:29,742] Trial 10 finished with value: 0.8599521843077593 and parameters: {'C': 20, 'gamma': 0.01, 'kernel': 'rbf', 'degree': 5, 'class_weight': 'balanced'}. Best is trial 4 with value: 0.8739621821343186.
[I 2026-05-12 14:29:33,545] Trial 11 finished with value: 0.8721017170180396 and parameters: {'C': 1.3, 'gamma': 'scale', 'kernel': 'linear', 'degree': 2, 'class_weight': 'balanced'}. Best is trial 4 with value: 0.8739621821343186.
[I 2026-05-12 14:29:37,462] Trial 12 finished with value: 0.8721017170180396 and parameters: {'C': 1.3, 'gamma': 8e-05, 'kernel': 'linear', 'degree': 2, 'class_weight': 'balanced'}. Best is trial 4 with value: 0.8739621821343186.
[I 2026-05-12 14:29:43,429] Trial 13 finished with value: 0.8739621821343186 and parameters: {'C': 20, 'gamma': 2, 'kernel': 'linear', 'degree': 2, 'class_weight': None}. Best is trial 4 with value: 0.8739621821343186.
[I 2026-05-12 14:29:48,649] Trial 14 finished with value: 0.8739621821343186 and parameters: {'C': 20, 'gamma': 5e-05, 'kernel': 'linear', 'degree': 5, 'class_weight': None}. Best is trial 4 with value: 0.8739621821343186.
[I 2026-05-12 14:29:53,721] Trial 15 finished with value: 0.8702369050206478 and parameters: {'C': 3, 'gamma': 1, 'kernel': 'linear', 'degree': 2, 'class_weight': 'balanced'}. Best is trial 4 with value: 0.8739621821343186.
[I 2026-05-12 14:29:59,617] Trial 16 finished with value: 0.5209302325581395 and parameters: {'C': 7.6, 'gamma': 0.001, 'kernel': 'rbf', 'degree': 5, 'class_weight': None}. Best is trial 4 with value: 0.8739621821343186.
[I 2026-05-12 14:30:04,927] Trial 17 finished with value: 0.5209302325581395 and parameters: {'C': 0.001, 'gamma': 5, 'kernel': 'linear', 'degree': 3, 'class_weight': 'balanced'}. Best is trial 4 with value: 0.8739621821343186.
[I 2026-05-12 14:30:10,073] Trial 18 finished with value: 0.8664985872636384 and parameters: {'C': 7.8, 'gamma': 0.1, 'kernel': 'linear', 'degree': 2, 'class_weight': None}. Best is trial 4 with value: 0.8739621821343186.
[I 2026-05-12 14:30:15,464] Trial 19 finished with value: 0.7637557052814606 and parameters: {'C': 10, 'gamma': 10, 'kernel': 'rbf', 'degree': 5, 'class_weight': 'balanced'}. Best is trial 4 with value: 0.8739621821343186.
[I 2026-05-12 14:30:20,581] Trial 20 finished with value: 0.8674331667028907 and parameters: {'C': 13, 'gamma': 0.002, 'kernel': 'linear', 'degree': 5, 'class_weight': 'balanced'}. Best is trial 4 with value: 0.8739621821343186.
[I 2026-05-12 14:30:25,736] Trial 21 finished with value: 0.8739621821343186 and parameters: {'C': 20, 'gamma': 5e-05, 'kernel': 'linear', 'degree': 5, 'class_weight': None}. Best is trial 4 with value: 0.8739621821343186.
[I 2026-05-12 14:30:31,000] Trial 22 finished with value: 0.8739621821343186 and parameters: {'C': 20, 'gamma': 5e-05, 'kernel': 'linear', 'degree': 5, 'class_weight': None}. Best is trial 4 with value: 0.8739621821343186.
[I 2026-05-12 14:30:36,071] Trial 23 finished with value: 0.8674331667028907 and parameters: {'C': 12, 'gamma': 5e-05, 'kernel': 'linear', 'degree': 5, 'class_weight': None}. Best is trial 4 with value: 0.8739621821343186.
[I 2026-05-12 14:30:41,143] Trial 24 finished with value: 0.8739621821343186 and parameters: {'C': 20, 'gamma': 2, 'kernel': 'linear', 'degree': 5, 'class_weight': None}. Best is trial 4 with value: 0.8739621821343186.
[I 2026-05-12 14:30:46,732] Trial 25 finished with value: 0.7488806781134536 and parameters: {'C': 0.1, 'gamma': 0.001, 'kernel': 'linear', 'degree': 2, 'class_weight': None}. Best is trial 4 with value: 0.8739621821343186.
[I 2026-05-12 14:30:52,497] Trial 26 finished with value: 0.8664985872636384 and parameters: {'C': 7.9, 'gamma': 10, 'kernel': 'linear', 'degree': 4, 'class_weight': None}. Best is trial 4 with value: 0.8739621821343186.
[I 2026-05-12 14:30:57,017] Trial 27 finished with value: 0.8664985872636384 and parameters: {'C': 7, 'gamma': 0.1, 'kernel': 'linear', 'degree': 3, 'class_weight': None}. Best is trial 4 with value: 0.8739621821343186.
[I 2026-05-12 14:31:02,036] Trial 28 finished with value: 0.5665116279069767 and parameters: {'C': 6.5, 'gamma': 8e-05, 'kernel': 'poly', 'degree': 5, 'class_weight': 'balanced'}. Best is trial 4 with value: 0.8739621821343186.
[I 2026-05-12 14:31:06,994] Trial 29 finished with value: 0.8020951966963704 and parameters: {'C': 6.8, 'gamma': 0.01, 'kernel': 'rbf', 'degree': 3, 'class_weight': 'balanced'}. Best is trial 4 with value: 0.8739621821343186.
[I 2026-05-12 14:31:11,711] Trial 30 finished with value: 0.8664985872636384 and parameters: {'C': 8.3, 'gamma': 1, 'kernel': 'linear', 'degree': 2, 'class_weight': None}. Best is trial 4 with value: 0.8739621821343186.
[I 2026-05-12 14:31:16,334] Trial 31 finished with value: 0.8739621821343186 and parameters: {'C': 20, 'gamma': 5e-05, 'kernel': 'linear', 'degree': 5, 'class_weight': None}. Best is trial 4 with value: 0.8739621821343186.
[I 2026-05-12 14:31:20,207] Trial 32 finished with value: 0.8739578352532058 and parameters: {'C': 1.1, 'gamma': 5e-05, 'kernel': 'linear', 'degree': 5, 'class_weight': None}. Best is trial 4 with value: 0.8739621821343186.
[I 2026-05-12 14:31:25,313] Trial 33 finished with value: 0.8664985872636384 and parameters: {'C': 8.4, 'gamma': 5e-05, 'kernel': 'linear', 'degree': 5, 'class_weight': None}. Best is trial 4 with value: 0.8739621821343186.
[I 2026-05-12 14:31:29,871] Trial 34 finished with value: 0.8655553140621605 and parameters: {'C': 0.8, 'gamma': 5, 'kernel': 'linear', 'degree': 5, 'class_weight': None}. Best is trial 4 with value: 0.8739621821343186.
[I 2026-05-12 14:31:34,643] Trial 35 finished with value: 0.5341056292110411 and parameters: {'C': 9, 'gamma': 2, 'kernel': 'poly', 'degree': 5, 'class_weight': None}. Best is trial 4 with value: 0.8739621821343186.
[I 2026-05-12 14:31:39,430] Trial 36 finished with value: 0.8664985872636384 and parameters: {'C': 8, 'gamma': 0.002, 'kernel': 'linear', 'degree': 4, 'class_weight': None}. Best is trial 4 with value: 0.8739621821343186.
[I 2026-05-12 14:31:44,181] Trial 37 finished with value: 0.5135448815474897 and parameters: {'C': 11, 'gamma': 'scale', 'kernel': 'poly', 'degree': 5, 'class_weight': None}. Best is trial 4 with value: 0.8739621821343186.
[I 2026-05-12 14:31:48,807] Trial 38 finished with value: 0.8664985872636384 and parameters: {'C': 8.2, 'gamma': 0.005, 'kernel': 'linear', 'degree': 4, 'class_weight': 'balanced'}. Best is trial 4 with value: 0.8739621821343186.
[I 2026-05-12 14:31:54,225] Trial 39 finished with value: 0.7880460769397957 and parameters: {'C': 1.2, 'gamma': 7, 'kernel': 'rbf', 'degree': 5, 'class_weight': None}. Best is trial 4 with value: 0.8739621821343186.
[I 2026-05-12 14:32:00,052] Trial 40 finished with value: 0.8702369050206477 and parameters: {'C': 6, 'gamma': 0.002, 'kernel': 'linear', 'degree': 2, 'class_weight': None}. Best is trial 4 with value: 0.8739621821343186.
[I 2026-05-12 14:32:05,512] Trial 41 finished with value: 0.8739621821343186 and parameters: {'C': 20, 'gamma': 5e-05, 'kernel': 'linear', 'degree': 5, 'class_weight': None}. Best is trial 4 with value: 0.8739621821343186.
[I 2026-05-12 14:32:11,629] Trial 42 finished with value: 0.8739621821343186 and parameters: {'C': 20, 'gamma': 5e-05, 'kernel': 'linear', 'degree': 5, 'class_weight': None}. Best is trial 4 with value: 0.8739621821343186.
[I 2026-05-12 14:32:17,353] Trial 43 finished with value: 0.8739621821343186 and parameters: {'C': 20, 'gamma': 5e-05, 'kernel': 'linear', 'degree': 5, 'class_weight': None}. Best is trial 4 with value: 0.8739621821343186.
[I 2026-05-12 14:32:22,380] Trial 44 finished with value: 0.8664985872636384 and parameters: {'C': 7.7, 'gamma': 2, 'kernel': 'linear', 'degree': 5, 'class_weight': None}. Best is trial 4 with value: 0.8739621821343186.
[I 2026-05-12 14:32:27,381] Trial 45 finished with value: 0.8580873723103674 and parameters: {'C': 0.4, 'gamma': 5e-05, 'kernel': 'linear', 'degree': 5, 'class_weight': 'balanced'}. Best is trial 4 with value: 0.8739621821343186.
[I 2026-05-12 14:32:33,407] Trial 46 finished with value: 0.5032558139534884 and parameters: {'C': 8.5, 'gamma': 0.002, 'kernel': 'poly', 'degree': 3, 'class_weight': None}. Best is trial 4 with value: 0.8739621821343186.
[I 2026-05-12 14:32:38,858] Trial 47 finished with value: 0.8692979787002825 and parameters: {'C': 15, 'gamma': 5e-05, 'kernel': 'linear', 'degree': 2, 'class_weight': None}. Best is trial 4 with value: 0.8739621821343186.
[I 2026-05-12 14:32:45,307] Trial 48 finished with value: 0.8664985872636384 and parameters: {'C': 7.5, 'gamma': 2, 'kernel': 'linear', 'degree': 5, 'class_weight': 'balanced'}. Best is trial 4 with value: 0.8739621821343186.
[I 2026-05-12 14:32:51,949] Trial 49 finished with value: 0.5209302325581395 and parameters: {'C': 1, 'gamma': 0.005, 'kernel': 'rbf', 'degree': 4, 'class_weight': None}. Best is trial 4 with value: 0.8739621821343186.
Meilleur score pour SVC : 0.874
Meilleurs paramètres pour SVC : {'C': 20, 'gamma': 0.002, 'kernel': 'linear', 'degree': 5, 'class_weight': 'balanced'}
Accuracy : 0.869281045751634
Matrice de confusion
[[189  41]
 [ 19 210]]
Classification report
              precision    recall  f1-score   support

           0       0.91      0.82      0.86       230
           1       0.84      0.92      0.88       229

    accuracy                           0.87       459
   macro avg       0.87      0.87      0.87       459
weighted avg       0.87      0.87      0.87       459

Accuracy  sur le jeu de test : 0.869
###################################
# SAUVEGARDE
###################################
nom de la pipeline : emojisSMOTE_SVC_meilleurHyperParam
(1526, 1764)
(1526,)
format du jeu d'apprentissage : (1068, 1764)
format du jeu de test : (458, 1764)
model créé
pipeline créée
{'C': 20, 'gamma': 0.002, 'kernel': 'linear', 'degree': 5, 'class_weight': 'balanced'}
modèle entrainée
pipeline saved
Le modèle sera sauvegardé ici : D:\mes programmes python\HAI817I-Machine-learning-m-thodes-classiques
modèle chargée
prediction réalisée
Résultat du pipeline sur les données isolées :
      reel  prediction
519      0           0
589      0           0
1434     1           1
197      1           0