nom de la matrice : baseSMOTE2mots
------ Chargement du dataset depuis : D:\mes programmes python\HAI81
   1st  4th  USER  USER USER  USER cause  USER come  USER find  USERated
0  0.0  0.0   0.0        0.0         0.0        0.0        0.0         0
1  0.0  0.0   0.0        0.0         0.0        0.0        0.0         0
2  0.0  0.0   0.0        0.0         0.0        0.0        0.0         1
3  0.0  0.0   0.0        0.0         0.0        0.0        0.0         1
4  0.0  0.0   0.0        0.0         0.0        0.0        0.0         1

[5 rows x 1756 columns]
(1530, 1756)
(1530, 1755)
(1530,)
format du jeu d'apprentissage : (1071, 1755)
format du jeu de test : (459, 1755)
Répartition des classes :
Classe 0 : 765 échantillons
Classe 1 : 765 échantillons
KFold sur SVC : accuracy moyenne : 0.8842332987192801 écart-type : 0
Accuracy : 0.9106753812636166
Matrice de confusion
[[216  14]
 [ 27 202]]
Classification report
              precision    recall  f1-score   support

           0       0.89      0.94      0.91       230
           1       0.94      0.88      0.91       229

    accuracy                           0.91       459
   macro avg       0.91      0.91      0.91       459
weighted avg       0.91      0.91      0.91       459

Quel classifieur choisissez-vous
:SVC
--------------------------- Optuna ---------------------------


[I 2026-05-11 16:54:27,935] A new study created in memory with name:
Exception ignored in: <function Image.__del__ at 0x000001E74E3A4860>
Traceback (most recent call last):
  File "D:\Python\Lib\tkinter\__init__.py", line 4073, in __del__
    self.tk.call('image', 'delete', self.name)
RuntimeError: main thread is not in main loop
Exception ignored in: <function Variable.__del__ at 0x000001E74E301C
Traceback (most recent call last):
  File "D:\Python\Lib\tkinter\__init__.py", line 410, in __del__
    if self._tk.getboolean(self._tk.call("info", "exists", self._nam
                           ^^^^^^^^^^^^^^^^^^^^^^^^^^^^^^^^^^^^^^^^^
RuntimeError: main thread is not in main loop
Exception ignored in: <function Variable.__del__ at 0x000001E74E301C
Traceback (most recent call last):
  File "D:\Python\Lib\tkinter\__init__.py", line 410, in __del__
    if self._tk.getboolean(self._tk.call("info", "exists", self._nam
                           ^^^^^^^^^^^^^^^^^^^^^^^^^^^^^^^^^^^^^^^^^
RuntimeError: main thread is not in main loop
Exception ignored in: <function Variable.__del__ at 0x000001E74E301C
Traceback (most recent call last):
  File "D:\Python\Lib\tkinter\__init__.py", line 410, in __del__
    if self._tk.getboolean(self._tk.call("info", "exists", self._nam
                           ^^^^^^^^^^^^^^^^^^^^^^^^^^^^^^^^^^^^^^^^^
RuntimeError: main thread is not in main loop
Exception ignored in: <function Variable.__del__ at 0x000001E74E301C
Traceback (most recent call last):
  File "D:\Python\Lib\tkinter\__init__.py", line 410, in __del__
    if self._tk.getboolean(self._tk.call("info", "exists", self._nam
                           ^^^^^^^^^^^^^^^^^^^^^^^^^^^^^^^^^^^^^^^^^
RuntimeError: main thread is not in main loop
[I 2026-05-11 16:54:59,807] Trial 0 finished with value: 0.5227906975227906976744185.
Exception ignored in: <function Variable.__del__ at 0x000001E74E301C
Traceback (most recent call last):
  File "D:\Python\Lib\tkinter\__init__.py", line 410, in __del__
    if self._tk.getboolean(self._tk.call("info", "exists", self._nam
                           ^^^^^^^^^^^^^^^^^^^^^^^^^^^^^^^^^^^^^^^^^
RuntimeError: main thread is not in main loop
Exception ignored in: <function Variable.__del__ at 0x000001E74E301C
Traceback (most recent call last):
  File "D:\Python\Lib\tkinter\__init__.py", line 410, in __del__
    if self._tk.getboolean(self._tk.call("info", "exists", self._nam
                           ^^^^^^^^^^^^^^^^^^^^^^^^^^^^^^^^^^^^^^^^^
RuntimeError: main thread is not in main loop
Exception ignored in: <function Variable.__del__ at 0x000001E74E301C
Traceback (most recent call last):
  File "D:\Python\Lib\tkinter\__init__.py", line 410, in __del__
    if self._tk.getboolean(self._tk.call("info", "exists", self._nam
                           ^^^^^^^^^^^^^^^^^^^^^^^^^^^^^^^^^^^^^^^^^
RuntimeError: main thread is not in main loop
Exception ignored in: <function Variable.__del__ at 0x000001E74E301C
Traceback (most recent call last):
  File "D:\Python\Lib\tkinter\__init__.py", line 410, in __del__
    if self._tk.getboolean(self._tk.call("info", "exists", self._nam
                           ^^^^^^^^^^^^^^^^^^^^^^^^^^^^^^^^^^^^^^^^^
RuntimeError: main thread is not in main loop
Exception ignored in: <function Image.__del__ at 0x000001E74E3A4860>
Traceback (most recent call last):
  File "D:\Python\Lib\tkinter\__init__.py", line 4073, in __del__
    self.tk.call('image', 'delete', self.name)
RuntimeError: main thread is not in main loop
[I 2026-05-11 16:55:23,828] Trial 1 finished with value: 0.541395348e: 0.5413953488372093.
[I 2026-05-11 16:55:30,281] Trial 2 finished with value: 0.537674418.5413953488372093.
[I 2026-05-11 16:55:36,257] Trial 3 finished with value: 0.5376744183488372093.
[I 2026-05-11 16:55:41,957] Trial 4 finished with value: 0.524738100 0.5413953488372093.
[I 2026-05-11 16:55:49,105] Trial 5 finished with value: 0.850615083.8506150836774614.
[I 2026-05-11 16:55:55,166] Trial 6 finished with value: 0.541395348506150836774614.
[I 2026-05-11 16:56:01,535] Trial 7 finished with value: 0.561860465e: 0.8506150836774614.
[I 2026-05-11 16:56:06,958] Trial 8 finished with value: 0.8553140628553140621604.
[I 2026-05-11 16:56:13,694] Trial 9 finished with value: 0.5255813950.8553140621604.
[I 2026-05-11 16:56:22,432] Trial 10 finished with value: 0.8553140640621604.
[I 2026-05-11 16:56:30,630] Trial 11 finished with value: 0.8553140640621604.
[I 2026-05-11 16:56:37,575] Trial 12 finished with value: 0.854375133140621604.
[I 2026-05-11 16:56:43,910] Trial 13 finished with value: 0.855314063140621604.
[I 2026-05-11 16:56:48,856] Trial 14 finished with value: 0.86091719e: 0.8609171919148011.
[I 2026-05-11 16:56:53,658] Trial 15 finished with value: 0.86091719ue: 0.8609171919148011.
[I 2026-05-11 16:56:59,798] Trial 16 finished with value: 0.85996522e: 0.8609171919148011.
[I 2026-05-11 16:57:04,512] Trial 17 finished with value: 0.86091719value: 0.8609171919148011.
[I 2026-05-11 16:57:08,931] Trial 18 finished with value: 0.86091719ue: 0.8609171919148011.
[I 2026-05-11 16:57:14,192] Trial 19 finished with value: 0.85904803 0.8609171919148011.
[I 2026-05-11 16:57:18,610] Trial 20 finished with value: 0.86092153h value: 0.8609215387959139.
[I 2026-05-11 16:57:24,011] Trial 21 finished with value: 0.85624864h value: 0.8609215387959139.
[I 2026-05-11 16:57:28,361] Trial 22 finished with value: 0.86092153h value: 0.8609215387959139.
[I 2026-05-11 16:57:32,796] Trial 23 finished with value: 0.86092153h value: 0.8609215387959139.
[I 2026-05-11 16:57:38,376] Trial 24 finished with value: 0.8609215387959139 and parameters: {'C': 1.4, 'gamma': 'scale', 'kernel': 'linear', 'degree': 2, 'class_weight': 'balanced'}. Best is trial 20 with value: 0.8609215387959139.
[I 2026-05-11 16:57:45,340] Trial 25 finished with value: 0.8795783525320584 and parameters: {'C': 1.4, 'gamma': 'scale', 'kernel': 'rbf', 'degree': 2, 'class_weight': 'balanced'}. Best is trial 25 with value: 0.8795783525320584.
[I 2026-05-11 16:57:51,070] Trial 26 finished with value: 0.8870419474027387 and parameters: {'C': 7.6, 'gamma': 'scale', 'kernel': 'rbf', 'degree': 2, 'class_weight': 'balanced'}. Best is trial 26 with value: 0.8870419474027387.
[I 2026-05-11 16:57:57,409] Trial 27 finished with value: 0.5227906976744185 and parameters: {'C': 7.6, 'gamma': 8e-05, 'kernel': 'rbf', 'degree': 2, 'class_weight': 'balanced'}. Best is trial 26 with value: 0.8870419474027387.
[I 2026-05-11 16:58:02,867] Trial 28 finished with value: 0.8870419474027387 and parameters: {'C': 7.6, 'gamma': 'scale', 'kernel': 'rbf', 'degree': 2, 'class_weight': 'balanced'}. Best is trial 26 with value: 0.8870419474027387.
[I 2026-05-11 16:58:08,691] Trial 29 finished with value: 0.5227906976744185 and parameters: {'C': 7.6, 'gamma': 0.001, 'kernel': 'rbf', 'degree': 2, 'class_weight': 'balanced'}. Best is trial 26 with value: 0.8870419474027387.
[I 2026-05-11 16:58:15,006] Trial 30 finished with value: 0.8861073679634861 and parameters: {'C': 8.3, 'gamma': 'scale', 'kernel': 'rbf', 'degree': 2, 'class_weight': 'balanced'}. Best is trial 26 with value: 0.8870419474027387.
[I 2026-05-11 16:58:20,464] Trial 31 finished with value: 0.8861073679634861 and parameters: {'C': 8.3, 'gamma': 'scale', 'kernel': 'rbf', 'degree': 2, 'class_weight': 'balanced'}. Best is trial 26 with value: 0.8870419474027387.
[I 2026-05-11 16:58:25,908] Trial 32 finished with value: 0.8861073679634861 and parameters: {'C': 8.3, 'gamma': 'scale', 'kernel': 'rbf', 'degree': 2, 'class_weight': 'balanced'}. Best is trial 26 with value: 0.8870419474027387.
[I 2026-05-11 16:58:31,461] Trial 33 finished with value: 0.8861073679634861 and parameters: {'C': 8.3, 'gamma': 'scale', 'kernel': 'rbf', 'degree': 2, 'class_weight': 'balanced'}. Best is trial 26 with value: 0.8870419474027387.
[I 2026-05-11 16:58:36,855] Trial 34 finished with value: 0.8861073679634861 and parameters: {'C': 8, 'gamma': 'scale', 'kernel': 'rbf', 'degree': 2, 'class_weight': 'balanced'}. Best is trial 26 with value: 0.8870419474027387.
[I 2026-05-11 16:58:43,156] Trial 35 finished with value: 0.5227906976744185 and parameters: {'C': 8.4, 'gamma': 8e-05, 'kernel': 'rbf', 'degree': 2, 'class_weight': 'balanced'}. Best is trial 26 with value: 0.8870419474027387.
[I 2026-05-11 16:58:48,973] Trial 36 finished with value: 0.8179439252336449 and parameters: {'C': 7.5, 'gamma': 5, 'kernel': 'rbf', 'degree': 3, 'class_weight': 'balanced'}. Best is trial 26 with value: 0.8870419474027387.
[I 2026-05-11 16:58:53,621] Trial 37 finished with value: 0.8683851336665942 and parameters: {'C': 6.8, 'gamma': 0.1, 'kernel': 'rbf', 'degree': 2, 'class_weight': None}. Best is trial 26 with value: 0.8870419474027387.
[I 2026-05-11 16:58:59,319] Trial 38 finished with value: 0.6059682677678767 and parameters: {'C': 10, 'gamma': 0.002, 'kernel': 'rbf', 'degree': 2, 'class_weight': 'balanced'}. Best is trial 26 with value: 0.8870419474027387.
[I 2026-05-11 16:59:04,786] Trial 39 finished with value: 0.8571614866333407 and parameters: {'C': 1.3, 'gamma': 2, 'kernel': 'rbf', 'degree': 3, 'class_weight': 'balanced'}. Best is trial 26 with value: 0.8870419474027387.
[I 2026-05-11 16:59:10,641] Trial 40 finished with value: 0.8142403825255379 and parameters: {'C': 11, 'gamma': 0.005, 'kernel': 'rbf', 'degree': 2, 'class_weight': 'balanced'}. Best is trial 26 with value: 0.8870419474027387.
[I 2026-05-11 16:59:16,539] Trial 41 finished with value: 0.8861073679634861 and parameters: {'C': 7, 'gamma': 'scale', 'kernel': 'rbf', 'degree': 2, 'class_weight': 'balanced'}. Best is trial 26 with value: 0.8870419474027387.
[I 2026-05-11 16:59:22,965] Trial 42 finished with value: 0.8301021517061509 and parameters: {'C': 8.3, 'gamma': 0.01, 'kernel': 'rbf', 'degree': 2, 'class_weight': 'balanced'}. Best is trial 26 with value: 0.8870419474027387.
[I 2026-05-11 16:59:28,444] Trial 43 finished with value: 0.8861073679634861 and parameters: {'C': 8.3, 'gamma': 'scale', 'kernel': 'rbf', 'degree': 2, 'class_weight': 'balanced'}. Best is trial 26 with value: 0.8870419474027387.
[I 2026-05-11 16:59:34,047] Trial 44 finished with value: 0.7852510323842643 and parameters: {'C': 1.1, 'gamma': 7, 'kernel': 'rbf', 'degree': 2, 'class_weight': 'balanced'}. Best is trial 26 with value: 0.8870419474027387.
[I 2026-05-11 16:59:40,159] Trial 45 finished with value: 0.5227906976744185 and parameters: {'C': 13, 'gamma': 5e-05, 'kernel': 'rbf', 'degree': 2, 'class_weight': None}. Best is trial 26 with value: 0.8870419474027387.
[I 2026-05-11 16:59:48,046] Trial 46 finished with value: 0.5618604651162791 and parameters: {'C': 7.7, 'gamma': 0.001, 'kernel': 'poly', 'degree': 3, 'class_weight': 'balanced'}. Best is trial 26 with value: 0.8870419474027387.
[I 2026-05-11 16:59:53,866] Trial 47 finished with value: 0.8861073679634861 and parameters: {'C': 7.8, 'gamma': 'scale', 'kernel': 'rbf', 'degree': 2, 'class_weight': 'balanced'}. Best is trial 26 with value: 0.8870419474027387.
[I 2026-05-11 16:59:59,415] Trial 48 finished with value: 0.8702282112584221 and parameters: {'C': 1, 'gamma': 'scale', 'kernel': 'rbf', 'degree': 2, 'class_weight': None}. Best is trial 26 with value: 0.8870419474027387.
[I 2026-05-11 17:00:05,456] Trial 49 finished with value: 0.7023386220386871 and parameters: {'C': 9, 'gamma': 5, 'kernel': 'poly', 'degree': 5, 'class_weight': 'balanced'}. Best is trial 26 with value: 0.8870419474027387.
Meilleur score pour SVC : 0.887
Meilleurs paramètres pour SVC : {'C': 7.6, 'gamma': 'scale', 'kernel': 'rbf', 'degree': 2, 'class_weight': 'balanced'}
Accuracy : 0.9019607843137255
Matrice de confusion
[[206  24]
 [ 21 208]]
Classification report
              precision    recall  f1-score   support

           0       0.91      0.90      0.90       230
           1       0.90      0.91      0.90       229

    accuracy                           0.90       459
   macro avg       0.90      0.90      0.90       459
weighted avg       0.90      0.90      0.90       459

Accuracy  sur le jeu de test : 0.902
###################################
# SAUVEGARDE
###################################
nom de la pipeline : SMOTE(2mots)_SVC_hyperParam
(1526, 1755)
(1526,)
format du jeu d'apprentissage : (1068, 1755)
format du jeu de test : (458, 1755)
model créé
pipeline créée
{'C': 7.6, 'gamma': 'scale', 'kernel': 'rbf', 'degree': 2, 'class_weight': 'balanced'}
modèle entrainée
pipeline saved
Le modèle sera sauvegardé ici : D:\mes programmes python\HAI817I-Machine-learning-m-thodes-classiquesmodèle chargée
prediction réalisée
résultat du pipeline :
      1st  4th      USER  USER USER  USER cause  ...  young  youth  youtube  yrs  science_related
1268  0.0  0.0  0.098055        0.0         0.0  ...    0.0    0.0      0.0  0.0                1
738   0.0  0.0  0.000000        0.0         0.0  ...    0.0    0.0      0.0  0.0                0
284   0.0  0.0  0.000000        0.0         0.0  ...    0.0    0.0      0.0  0.0                1
1317  0.0  0.0  0.000000        0.0         0.0  ...    0.0    0.0      0.0  0.0                1

[4 rows x 1756 columns]