[I 2026-04-28 15:10:34,743] Trial 13 finished with value: 0.8179439252336449 and parameters: {'C': 6.8, 'gamma': 5, 'kernel': '3467.
Exception ignored in: <function Image.__del__ at 0x000001D00F4E4860>
Traceback (most recent call last):
  File "D:\Python\Lib\tkinter\__init__.py", line 4073, in __del__
    self.tk.call('image', 'delete', self.name)
RuntimeError: main thread is not in main loop
Exception ignored in: <function Variable.__del__ at 0x000001D00F445C60>
Traceback (most recent call last):
  File "D:\Python\Lib\tkinter\__init__.py", line 410, in __del__
    if self._tk.getboolean(self._tk.call("info", "exists", self._name)):
                           ^^^^^^^^^^^^^^^^^^^^^^^^^^^^^^^^^^^^^^^^^^^
RuntimeError: main thread is not in main loop
Exception ignored in: <function Variable.__del__ at 0x000001D00F445C60>
Traceback (most recent call last):
  File "D:\Python\Lib\tkinter\__init__.py", line 410, in __del__
    if self._tk.getboolean(self._tk.call("info", "exists", self._name)):
                           ^^^^^^^^^^^^^^^^^^^^^^^^^^^^^^^^^^^^^^^^^^^
RuntimeError: main thread is not in main loop
Exception ignored in: <function Variable.__del__ at 0x000001D00F445C60>
Traceback (most recent call last):
  File "D:\Python\Lib\tkinter\__init__.py", line 410, in __del__
    if self._tk.getboolean(self._tk.call("info", "exists", self._name)):
                           ^^^^^^^^^^^^^^^^^^^^^^^^^^^^^^^^^^^^^^^^^^^
RuntimeError: main thread is not in main loop
Exception ignored in: <function Variable.__del__ at 0x000001D00F445C60>
Traceback (most recent call last):
  File "D:\Python\Lib\tkinter\__init__.py", line 410, in __del__
    if self._tk.getboolean(self._tk.call("info", "exists", self._name)):
                           ^^^^^^^^^^^^^^^^^^^^^^^^^^^^^^^^^^^^^^^^^^^
RuntimeError: main thread is not in main loop
Exception ignored in: <function Image.__del__ at 0x000001D00F4E4860>
Traceback (most recent call last):
  File "D:\Python\Lib\tkinter\__init__.py", line 4073, in __del__
    self.tk.call('image', 'delete', self.name)
RuntimeError: main thread is not in main loop
Exception ignored in: <function Variable.__del__ at 0x000001D00F445C60>
Traceback (most recent call last):
  File "D:\Python\Lib\tkinter\__init__.py", line 410, in __del__
    if self._tk.getboolean(self._tk.call("info", "exists", self._name)):
                           ^^^^^^^^^^^^^^^^^^^^^^^^^^^^^^^^^^^^^^^^^^^
RuntimeError: main thread is not in main loop
Exception ignored in: <function Variable.__del__ at 0x000001D00F445C60>
Traceback (most recent call last):
  File "D:\Python\Lib\tkinter\__init__.py", line 410, in __del__
    if self._tk.getboolean(self._tk.call("info", "exists", self._name)):
                           ^^^^^^^^^^^^^^^^^^^^^^^^^^^^^^^^^^^^^^^^^^^
RuntimeError: main thread is not in main loop
Exception ignored in: <function Variable.__del__ at 0x000001D00F445C60>
Traceback (most recent call last):
  File "D:\Python\Lib\tkinter\__init__.py", line 410, in __del__
    if self._tk.getboolean(self._tk.call("info", "exists", self._name)):
                           ^^^^^^^^^^^^^^^^^^^^^^^^^^^^^^^^^^^^^^^^^^^
RuntimeError: main thread is not in main loop
Exception ignored in: <function Variable.__del__ at 0x000001D00F445C60>
Traceback (most recent call last):
  File "D:\Python\Lib\tkinter\__init__.py", line 410, in __del__
    if self._tk.getboolean(self._tk.call("info", "exists", self._name)):
                           ^^^^^^^^^^^^^^^^^^^^^^^^^^^^^^^^^^^^^^^^^^^
RuntimeError: main thread is not in main loop
[I 2026-04-28 15:11:18,491] Trial 14 finished with value: 0.8805085850901978 and parameters: {'C': 1.2, 'gamma': 1, 'kernel': '
[I 2026-04-28 15:11:24,129] Trial 15 finished with value: 0.5413953488372093 and parameters: {'C': 8, 'gamma': 0.005, 'kernel':4053467.
[I 2026-04-28 15:11:29,938] Trial 16 finished with value: 0.5227906976744185 and parameters: {'C': 0.001, 'gamma': 5e-05, 'kern1354053467.
[I 2026-04-28 15:11:35,308] Trial 17 finished with value: 0.8861073679634861 and parameters: {'C': 8, 'gamma': 'scale', 'kernel861.
[I 2026-04-28 15:11:40,592] Trial 18 finished with value: 0.8693066724625081 and parameters: {'C': 8, 'gamma': 'scale', 'kernel4861.
[I 2026-04-28 15:11:46,091] Trial 19 finished with value: 0.8590480330362965 and parameters: {'C': 6, 'gamma': 'scale', 'kernel634861.
[I 2026-04-28 15:11:50,880] Trial 20 finished with value: 0.8665159747880896 and parameters: {'C': 13, 'gamma': 0.1, 'kernel': .
[I 2026-04-28 15:11:56,832] Trial 21 finished with value: 0.7619039339274072 and parameters: {'C': 1.4, 'gamma': 10, 'kernel': .
[I 2026-04-28 15:12:02,179] Trial 22 finished with value: 0.8851771354053467 and parameters: {'C': 8, 'gamma': 1, 'kernel': 'rb
[I 2026-04-28 15:12:07,710] Trial 23 finished with value: 0.8861073679634861 and parameters: {'C': 8, 'gamma': 'scale', 'kernel861.
[I 2026-04-28 15:12:13,558] Trial 24 finished with value: 0.8861073679634861 and parameters: {'C': 8, 'gamma': 'scale', 'kernel861.
[I 2026-04-28 15:12:18,941] Trial 25 finished with value: 0.8861073679634861 and parameters: {'C': 7.8, 'gamma': 'scale', 'kern34861.
[I 2026-04-28 15:12:24,328] Trial 26 finished with value: 0.8786481199739187 and parameters: {'C': 1.3, 'gamma': 'scale', 'kern34861.
[I 2026-04-28 15:12:30,467] Trial 27 finished with value: 0.8861073679634861 and parameters: {'C': 7.3, 'gamma': 'scale', 'kern34861.
[I 2026-04-28 15:12:37,758] Trial 28 finished with value: 0.6181612692892849 and parameters: {'C': 7, 'gamma': 'scale', 'kernel4861.
[I 2026-04-28 15:12:46,390] Trial 29 finished with value: 0.8086329058900239 and parameters: {'C': 0.1, 'gamma': 'scale', 'kern79634861.
[I 2026-04-28 15:12:53,213] Trial 30 finished with value: 0.7619039339274072 and parameters: {'C': 7.6, 'gamma': 10, 'kernel': .
[I 2026-04-28 15:12:59,662] Trial 31 finished with value: 0.8861073679634861 and parameters: {'C': 7.8, 'gamma': 'scale', 'kern34861.
[I 2026-04-28 15:13:05,592] Trial 32 finished with value: 0.8870419474027387 and parameters: {'C': 7.7, 'gamma': 'scale', 'kern27387.
[I 2026-04-28 15:13:11,677] Trial 33 finished with value: 0.8310323842642905 and parameters: {'C': 7.7, 'gamma': 0.01, 'kernel'87.
[I 2026-04-28 15:13:18,418] Trial 34 finished with value: 0.8870462942838515 and parameters: {'C': 15, 'gamma': 'scale', 'kerne8515.
[I 2026-04-28 15:13:25,200] Trial 35 finished with value: 0.7023386220386871 and parameters: {'C': 15, 'gamma': 5, 'kernel': 'poly', 'degree': 5, 'class_weight': None}. Best is trial 34 with value: 0.8870462942838515.
[I 2026-04-28 15:13:32,281] Trial 36 finished with value: 0.8217039773962183 and parameters: {'C': 12, 'gamma': 0.005, 'kernel': 'rbf', 'degree': 5, 'class_weight': None}. Best is trial 34 with value: 0.8870462942838515.
[I 2026-04-28 15:13:38,236] Trial 37 finished with value: 0.5227906976744185 and parameters: {'C': 10, 'gamma': 0.001, 'kernel': 'rbf', 'degree': 5, 'class_weight': None}. Best is trial 34 with value: 0.8870462942838515.
[I 2026-04-28 15:13:44,023] Trial 38 finished with value: 0.8646424690284722 and parameters: {'C': 11, 'gamma': 2, 'kernel': 'rbf', 'degree': 5, 'class_weight': None}. Best is trial 34 with value: 0.8870462942838515.
[I 2026-04-28 15:13:48,517] Trial 39 finished with value: 0.8571701803955663 and parameters: {'C': 0.8, 'gamma': 7, 'kernel': 'linear', 'degree': 5, 'class_weight': None}. Best is trial 34 with value: 0.8870462942838515.
[I 2026-04-28 15:13:54,629] Trial 40 finished with value: 0.5227906976744185 and parameters: {'C': 8.5, 'gamma': 5e-05, 'kernel': 'rbf', 'degree': 2, 'class_weight': None}. Best is trial 34 with value: 0.8870462942838515.
[I 2026-04-28 15:13:59,894] Trial 41 finished with value: 0.8767659204520758 and parameters: {'C': 1.1, 'gamma': 'scale', 'kernel': 'rbf', 'degree': 4, 'class_weight': None}. Best is trial 34 with value: 0.8870462942838515.
[I 2026-04-28 15:14:05,616] Trial 42 finished with value: 0.5237252771136709 and parameters: {'C': 8.1, 'gamma': 0.002, 'kernel': 'rbf', 'degree': 3, 'class_weight': None}. Best is trial 34 with value: 0.8870462942838515.
[I 2026-04-28 15:14:10,876] Trial 43 finished with value: 0.8879808737231037 and parameters: {'C': 20, 'gamma': 'scale', 'kernel': 'rbf', 'degree': 4, 'class_weight': None}. Best is trial 43 with value: 0.8879808737231037.
[I 2026-04-28 15:14:16,205] Trial 44 finished with value: 0.8879808737231037 and parameters: {'C': 20, 'gamma': 'scale', 'kernel': 'rbf', 'degree': 5, 'class_weight': None}. Best is trial 43 with value: 0.8879808737231037.
[I 2026-04-28 15:14:22,110] Trial 45 finished with value: 0.5227906976744185 and parameters: {'C': 20, 'gamma': 8e-05, 'kernel': 'rbf', 'degree': 5, 'class_weight': None}. Best is trial 43 with value: 0.8879808737231037.
[I 2026-04-28 15:14:26,796] Trial 46 finished with value: 0.8711714844598999 and parameters: {'C': 20, 'gamma': 0.1, 'kernel': 'rbf', 'degree': 5, 'class_weight': None}. Best is trial 43 with value: 0.8879808737231037.
[I 2026-04-28 15:14:32,134] Trial 47 finished with value: 0.8562486415996522 and parameters: {'C': 7.5, 'gamma': 0.01, 'kernel': 'linear', 'degree': 5, 'class_weight': 'balanced'}. Best is trial 43 with value: 0.8879808737231037.
[I 2026-04-28 15:14:37,486] Trial 48 finished with value: 0.5023386220386873 and parameters: {'C': 20, 'gamma': 'scale', 'kernel': 'poly', 'degree': 5, 'class_weight': None}. Best is trial 43 with value: 0.8879808737231037.
[I 2026-04-28 15:14:42,706] Trial 49 finished with value: 0.8870419474027387 and parameters: {'C': 7.7, 'gamma': 'scale', 'kernel': 'rbf', 'degree': 5, 'class_weight': None}. Best is trial 43 with value: 0.8879808737231037.
Meilleur score pour SVC : 0.888
Meilleurs paramètres pour SVC : {'C': 20, 'gamma': 'scale', 'kernel': 'rbf', 'degree': 4, 'class_weight': None}
Accuracy : 0.906318082788671
Matrice de confusion
[[207  23]
 [ 20 209]]
Classification report
              precision    recall  f1-score   support

           0       0.91      0.90      0.91       230
           1       0.90      0.91      0.91       229

    accuracy                           0.91       459
   macro avg       0.91      0.91      0.91       459
weighted avg       0.91      0.91      0.91       459

Accuracy  sur le jeu de test : 0.906
###################################
# SAUVEGARDE
###################################
nom de la pipeline : 































KFold sur SVC : accuracy moyenne : 0.8842332987192801 écart-type : 0.027086735269279724
Accuracy : 0.9106753812636166
Matrice de confusion
[[216  14]
 [ 27 202]]
Classification report
              precision    recall  f1-score   support

           0       0.89      0.94      0.91       230
           1       0.94      0.88      0.91       229

    accuracy                           0.91       459
   macro avg       0.91      0.91      0.91       459
weighted avg       0.91      0.91      0.91       459


Meilleurs paramètres pour SVC : {'C': 20, 'gamma': 'scale', 'kernel': 'rbf', 'degree': 4, 'class_weight': None}
Accuracy : 0.906318082788671
Matrice de confusion
[[207  23]
 [ 20 209]]
Classification report
              precision    recall  f1-score   support

           0       0.91      0.90      0.91       230
           1       0.90      0.91      0.91       229

    accuracy                           0.91       459
   macro avg       0.91      0.91      0.91       459
weighted avg       0.91      0.91      0.91       459