PS D:\mes programmes python\HAI817I-Machine-learning-m-thodes-classiques> & D:/Python/python.exe "d:/mes programmes python/HAI8
nom de la matrice : SMOTE
------ Chargement du dataset depuis : D:\mes programmes python\HAI817I-Machine-learning-m-thodes-classiques\src\matrices\SMOTE.
   1st  4th   HASHTAG  HASHTAG HASHTAG  HASHTAG USER  HASHTAG apply  HASHTAG article  HASHTAG call  HASHTAG cause  HASHTAG engi
0  0.0  0.0  0.000000              0.0           0.0            0.0              0.0           0.0            0.0              
1  0.0  0.0  0.000000              0.0           0.0            0.0              0.0           0.0            0.0              
2  0.0  0.0  0.199426              0.0           0.0            0.0              0.0           0.0            0.0              
3  0.0  0.0  0.000000              0.0           0.0            0.0              0.0           0.0            0.0              
4  0.0  0.0  0.000000              0.0           0.0            0.0              0.0           0.0            0.0              

[5 rows x 1768 columns]
(1530, 1768)
(1530, 1767)
(1530,)
format du jeu d'apprentissage : (1071, 1767)
format du jeu de test : (459, 1767)
Répartition des classes :
Classe 0 : 765 échantillons
Classe 1 : 765 échantillons
KFold sur SVC : accuracy moyenne : 0.8758307372793356 écart-type : 0.029501512400166647
Accuracy : 0.8976034858387799
Matrice de confusion
[[216  14]
 [ 33 196]]
Classification report
              precision    recall  f1-score   support

           0       0.87      0.94      0.90       230
           1       0.93      0.86      0.89       229

    accuracy                           0.90       459
   macro avg       0.90      0.90      0.90       459
weighted avg       0.90      0.90      0.90       459

Quel classifieur choisissez-vous
:SVC
--------------------------- Optuna ---------------------------


[I 2026-04-28 12:38:51,130] A new study created in memory with name: no-name-1e6e336a-5ad6-425f-b8ce-559973c9d45a
Exception ignored in: <function Image.__del__ at 0x000001B327B88EA0>
Traceback (most recent call last):
  File "D:\Python\Lib\tkinter\__init__.py", line 4073, in __del__
    self.tk.call('image', 'delete', self.name)
RuntimeError: main thread is not in main loop
Exception ignored in: <function Variable.__del__ at 0x000001B327ADE2A0>
Traceback (most recent call last):
  File "D:\Python\Lib\tkinter\__init__.py", line 410, in __del__
    if self._tk.getboolean(self._tk.call("info", "exists", self._name)):
                           ^^^^^^^^^^^^^^^^^^^^^^^^^^^^^^^^^^^^^^^^^^^
RuntimeError: main thread is not in main loop
Exception ignored in: <function Variable.__del__ at 0x000001B327ADE2A0>
Traceback (most recent call last):
  File "D:\Python\Lib\tkinter\__init__.py", line 410, in __del__
    if self._tk.getboolean(self._tk.call("info", "exists", self._name)):
                           ^^^^^^^^^^^^^^^^^^^^^^^^^^^^^^^^^^^^^^^^^^^
RuntimeError: main thread is not in main loop
Exception ignored in: <function Variable.__del__ at 0x000001B327ADE2A0>
Traceback (most recent call last):
  File "D:\Python\Lib\tkinter\__init__.py", line 410, in __del__
    if self._tk.getboolean(self._tk.call("info", "exists", self._name)):
                           ^^^^^^^^^^^^^^^^^^^^^^^^^^^^^^^^^^^^^^^^^^^
RuntimeError: main thread is not in main loop
Exception ignored in: <function Variable.__del__ at 0x000001B327ADE2A0>
Traceback (most recent call last):
  File "D:\Python\Lib\tkinter\__init__.py", line 410, in __del__
    if self._tk.getboolean(self._tk.call("info", "exists", self._name)):
                           ^^^^^^^^^^^^^^^^^^^^^^^^^^^^^^^^^^^^^^^^^^^
RuntimeError: main thread is not in main loop
[I 2026-04-28 12:39:20,206] Trial 0 finished with value: 0.83754835905238 and parameters: {'C': 15, 'gamma': 0.01, 'kernel': 'r
[I 2026-04-28 12:39:25,050] Trial 1 finished with value: 0.5060725929145838 and parameters: {'C': 10, 'gamma': 'scale', 'kernel
Exception ignored in: <function Image.__del__ at 0x000001B327B88EA0>
Traceback (most recent call last):
  File "D:\Python\Lib\tkinter\__init__.py", line 4073, in __del__
    self.tk.call('image', 'delete', self.name)
RuntimeError: main thread is not in main loop
Exception ignored in: <function Variable.__del__ at 0x000001B327ADE2A0>
Traceback (most recent call last):
  File "D:\Python\Lib\tkinter\__init__.py", line 410, in __del__
    if self._tk.getboolean(self._tk.call("info", "exists", self._name)):
                           ^^^^^^^^^^^^^^^^^^^^^^^^^^^^^^^^^^^^^^^^^^^
RuntimeError: main thread is not in main loop
Exception ignored in: <function Variable.__del__ at 0x000001B327ADE2A0>
Traceback (most recent call last):
  File "D:\Python\Lib\tkinter\__init__.py", line 410, in __del__
    if self._tk.getboolean(self._tk.call("info", "exists", self._name)):
                           ^^^^^^^^^^^^^^^^^^^^^^^^^^^^^^^^^^^^^^^^^^^
RuntimeError: main thread is not in main loop
Exception ignored in: <function Variable.__del__ at 0x000001B327ADE2A0>
Traceback (most recent call last):
  File "D:\Python\Lib\tkinter\__init__.py", line 410, in __del__
    if self._tk.getboolean(self._tk.call("info", "exists", self._name)):
                           ^^^^^^^^^^^^^^^^^^^^^^^^^^^^^^^^^^^^^^^^^^^
RuntimeError: main thread is not in main loop
Exception ignored in: <function Variable.__del__ at 0x000001B327ADE2A0>
Traceback (most recent call last):
  File "D:\Python\Lib\tkinter\__init__.py", line 410, in __del__
    if self._tk.getboolean(self._tk.call("info", "exists", self._name)):
                           ^^^^^^^^^^^^^^^^^^^^^^^^^^^^^^^^^^^^^^^^^^^
RuntimeError: main thread is not in main loop
[I 2026-04-28 12:39:51,314] Trial 2 finished with value: 0.5367441860465116 and parameters: {'C': 6, 'gamma': 8e-05, 'kernel': 
[I 2026-04-28 12:39:56,405] Trial 3 finished with value: 0.5367441860465116 and parameters: {'C': 0.4, 'gamma': 0.005, 'kernel'
[I 2026-04-28 12:40:00,929] Trial 4 finished with value: 0.8422256031297545 and parameters: {'C': 20, 'gamma': 0.01, 'kernel': 
[I 2026-04-28 12:40:05,731] Trial 5 finished with value: 0.8637035427081068 and parameters: {'C': 8, 'gamma': 'scale', 'kernel'
[I 2026-04-28 12:40:10,711] Trial 6 finished with value: 0.800221690936753 and parameters: {'C': 0.1, 'gamma': 0.1, 'kernel': '
[I 2026-04-28 12:40:15,604] Trial 7 finished with value: 0.8637035427081068 and parameters: {'C': 7.7, 'gamma': 0.1, 'kernel': 
[I 2026-04-28 12:40:20,405] Trial 8 finished with value: 0.504207780917192 and parameters: {'C': 7, 'gamma': 1, 'kernel': 'poly
[I 2026-04-28 12:40:25,310] Trial 9 finished with value: 0.8637035427081068 and parameters: {'C': 8.2, 'gamma': 5e-05, 'kernel'
[I 2026-04-28 12:40:30,057] Trial 10 finished with value: 0.8637035427081068 and parameters: {'C': 8, 'gamma': 'scale', 'kernel
[I 2026-04-28 12:40:34,881] Trial 11 finished with value: 0.8637035427081068 and parameters: {'C': 7.8, 'gamma': 10, 'kernel': 
[I 2026-04-28 12:40:40,276] Trial 12 finished with value: 0.8637035427081068 and parameters: {'C': 7.7, 'gamma': 0.002, 'kernel
[I 2026-04-28 12:40:45,216] Trial 13 finished with value: 0.8599652249510976 and parameters: {'C': 11, 'gamma': 7, 'kernel': 'l
[I 2026-04-28 12:40:50,201] Trial 14 finished with value: 0.8599608780699848 and parameters: {'C': 12, 'gamma': 0.1, 'kernel': 
[I 2026-04-28 12:40:55,403] Trial 15 finished with value: 0.5367441860465116 and parameters: {'C': 0.01, 'gamma': 0.001, 'kerne
[I 2026-04-28 12:41:00,184] Trial 16 finished with value: 0.5864377309280591 and parameters: {'C': 8.5, 'gamma': 2, 'kernel': '
[I 2026-04-28 12:41:04,044] Trial 17 finished with value: 0.8618300369484894 and parameters: {'C': 1.2, 'gamma': 5, 'kernel': '
[I 2026-04-28 12:41:07,998] Trial 18 finished with value: 0.861838730710715 and parameters: {'C': 1.1, 'gamma': 'scale', 'kerne
[I 2026-04-28 12:41:12,942] Trial 19 finished with value: 0.5516279069767441 and parameters: {'C': 1.4, 'gamma': 0.1, 'kernel':
[I 2026-04-28 12:41:17,955] Trial 20 finished with value: 0.5367441860465116 and parameters: {'C': 0.001, 'gamma': 0.002, 'kern
[I 2026-04-28 12:41:22,792] Trial 21 finished with value: 0.8637035427081068 and parameters: {'C': 8.2, 'gamma': 5e-05, 'kernel
[I 2026-04-28 12:41:27,832] Trial 22 finished with value: 0.8637035427081068 and parameters: {'C': 7.7, 'gamma': 5e-05, 'kernel
[I 2026-04-28 12:41:32,679] Trial 23 finished with value: 0.8637035427081068 and parameters: {'C': 8.1, 'gamma': 5e-05, 'kernel
[I 2026-04-28 12:41:37,529] Trial 24 finished with value: 0.8637035427081068 and parameters: {'C': 8, 'gamma': 2, 'kernel': 'li
[I 2026-04-28 12:41:42,358] Trial 25 finished with value: 0.8646337752662465 and parameters: {'C': 6.5, 'gamma': 1, 'kernel': '
[I 2026-04-28 12:41:47,182] Trial 26 finished with value: 0.8646337752662465 and parameters: {'C': 6.5, 'gamma': 1, 'kernel': '
[I 2026-04-28 12:41:52,055] Trial 27 finished with value: 0.8646337752662465 and parameters: {'C': 6.5, 'gamma': 1, 'kernel': '
[I 2026-04-28 12:41:56,798] Trial 28 finished with value: 0.8786437730928058 and parameters: {'C': 6.5, 'gamma': 1, 'kernel': '
[I 2026-04-28 12:42:01,587] Trial 29 finished with value: 0.8786437730928058 and parameters: {'C': 6.5, 'gamma': 1, 'kernel': '
[I 2026-04-28 12:42:06,339] Trial 30 finished with value: 0.8786437730928058 and parameters: {'C': 6.5, 'gamma': 1, 'kernel': '
[I 2026-04-28 12:42:11,086] Trial 31 finished with value: 0.8786437730928058 and parameters: {'C': 6.5, 'gamma': 1, 'kernel': '
[I 2026-04-28 12:42:15,810] Trial 32 finished with value: 0.8786437730928058 and parameters: {'C': 6.5, 'gamma': 1, 'kernel': '
[I 2026-04-28 12:42:20,489] Trial 33 finished with value: 0.8711671375787873 and parameters: {'C': 1.3, 'gamma': 1, 'kernel': '
[I 2026-04-28 12:42:25,219] Trial 34 finished with value: 0.8814518582916758 and parameters: {'C': 8.3, 'gamma': 1, 'kernel': '
[I 2026-04-28 12:42:30,280] Trial 35 finished with value: 0.5367441860465116 and parameters: {'C': 7.6, 'gamma': 8e-05, 'kernel
[I 2026-04-28 12:42:35,383] Trial 36 finished with value: 0.798335144533797 and parameters: {'C': 8.3, 'gamma': 0.005, 'kernel'
[I 2026-04-28 12:42:40,102] Trial 37 finished with value: 0.8795783525320582 and parameters: {'C': 6.8, 'gamma': 1, 'kernel': '
[I 2026-04-28 12:42:44,919] Trial 38 finished with value: 0.8795783525320582 and parameters: {'C': 6.8, 'gamma': 1, 'kernel': '
[I 2026-04-28 12:42:49,838] Trial 39 finished with value: 0.809550097804825 and parameters: {'C': 6.8, 'gamma': 0.01, 'kernel':
[I 2026-04-28 12:42:54,915] Trial 40 finished with value: 0.758161269289285 and parameters: {'C': 6.8, 'gamma': 10, 'kernel': '
[I 2026-04-28 12:42:59,644] Trial 41 finished with value: 0.8805172788524235 and parameters: {'C': 9, 'gamma': 1, 'kernel': 'rb
[I 2026-04-28 12:43:04,397] Trial 42 finished with value: 0.8805172788524235 and parameters: {'C': 9, 'gamma': 1, 'kernel': 'rb
[I 2026-04-28 12:43:09,454] Trial 43 finished with value: 0.8805172788524235 and parameters: {'C': 9, 'gamma': 1, 'kernel': 'rb
[I 2026-04-28 12:43:14,486] Trial 44 finished with value: 0.8020647685285809 and parameters: {'C': 3, 'gamma': 5, 'kernel': 'rb
[I 2026-04-28 12:43:19,570] Trial 45 finished with value: 0.5367441860465116 and parameters: {'C': 9, 'gamma': 0.001, 'kernel':
[I 2026-04-28 12:43:24,604] Trial 46 finished with value: 0.7824516409476201 and parameters: {'C': 9, 'gamma': 7, 'kernel': 'rb
[I 2026-04-28 12:43:29,383] Trial 47 finished with value: 0.8805172788524235 and parameters: {'C': 9, 'gamma': 1, 'kernel': 'rb
[I 2026-04-28 12:43:34,401] Trial 48 finished with value: 0.5367441860465116 and parameters: {'C': 9, 'gamma': 8e-05, 'kernel':
[I 2026-04-28 12:43:39,329] Trial 49 finished with value: 0.5637209302325582 and parameters: {'C': 9, 'gamma': 0.01, 'kernel': 
Meilleur score pour SVC : 0.881
Meilleurs paramètres pour SVC : {'C': 8.3, 'gamma': 1, 'kernel': 'rbf', 'degree': 2, 'class_weight': None}
Accuracy : 0.8997821350762527
Matrice de confusion
[[206  24]
 [ 22 207]]
Classification report
              precision    recall  f1-score   support

           0       0.90      0.90      0.90       230
           1       0.90      0.90      0.90       229

    accuracy                           0.90       459
   macro avg       0.90      0.90      0.90       459
weighted avg       0.90      0.90      0.90       459

Accuracy  sur le jeu de test : 0.9
###################################
# SAUVEGARDE
###################################
nom de la pipeline : SMOTE_SVC_BEST
(1526, 1767)
(1526,)
format du jeu d'apprentissage : (1068, 1767)
format du jeu de test : (458, 1767)
model créé
pipeline créée
{'C': 8.3, 'gamma': 1, 'kernel': 'rbf', 'degree': 2, 'class_weight': None}
modèle entrainée
pipeline saved
Le modèle sera sauvegardé ici : D:\mes programmes python\HAI817I-Machine-learning-m-thodes-classiques
modèle chargée
prediction réalisée
résultat du pipeline :
      1st  4th   HASHTAG  HASHTAG HASHTAG  HASHTAG USER  HASHTAG apply  HASHTAG article  HASHTAG call  HASHTAG cause  HASHTAG e
142   0.0  0.0  0.000000         0.000000           0.0            0.0              0.0           0.0            0.0           
537   0.0  0.0  0.170022         0.000000           0.0            0.0              0.0           0.0            0.0           
249   0.0  0.0  0.000000         0.000000           0.0            0.0              0.0           0.0            0.0           
1475  0.0  0.0  0.231054         0.093923           0.0            0.0              0.0           0.0            0.0           

[4 rows x 1768 columns]
PS D:\mes programmes python\HAI817I-Machine-learning-m-thodes-classiques> & D:/Python/python.exe "d:/mes programmes python/HAI8assifieur.py"
nom de la matrice : matrice_SMOTEST
------ Chargement du dataset depuis : D:\mes programmes python\HAI817I-Machine-learning-m-thodes-classiques\src\matrices\matric
   1st  4th  USER  USER USER  USER cause  USER come  USER find  USER follow  USER game  USER get  USER good  ...  wrong  year  
0  0.0  0.0   0.0        0.0         0.0        0.0        0.0          0.0        0.0       0.0        0.0  ...    0.0   0.0  
1  0.0  0.0   0.0        0.0         0.0        0.0        0.0          0.0        0.0       0.0        0.0  ...    0.0   0.0  
2  0.0  0.0   0.0        0.0         0.0        0.0        0.0          0.0        0.0       0.0        0.0  ...    0.0   0.0  
3  0.0  0.0   0.0        0.0         0.0        0.0        0.0          0.0        0.0       0.0        0.0  ...    0.0   0.0  
4  0.0  0.0   0.0        0.0         0.0        0.0        0.0          0.0        0.0       0.0        0.0  ...    0.0   0.0  

[5 rows x 1756 columns]
(1530, 1756)
(1530, 1755)
(1530,)
format du jeu d'apprentissage : (1071, 1755)
format du jeu de test : (459, 1755)
Répartition des classes :
Classe 0 : 765 échantillons
Classe 1 : 765 échantillons
KFold sur KNN : accuracy moyenne : 0.6862928348909657 écart-type : 0.052942089862686156
Accuracy : 0.7276688453159041
Matrice de confusion
[[133  97]
 [ 28 201]]
Classification report
              precision    recall  f1-score   support

           0       0.83      0.58      0.68       230
           1       0.67      0.88      0.76       229

    accuracy                           0.73       459
   macro avg       0.75      0.73      0.72       459
weighted avg       0.75      0.73      0.72       459

KFold sur DT : accuracy moyenne : 0.8002163378331602 écart-type : 0.03556090837670775
Accuracy : 0.8126361655773421
Matrice de confusion
[[176  54]
 [ 32 197]]
Classification report
              precision    recall  f1-score   support

           0       0.85      0.77      0.80       230
           1       0.78      0.86      0.82       229

    accuracy                           0.81       459
   macro avg       0.82      0.81      0.81       459
weighted avg       0.82      0.81      0.81       459

KFold sur GNB : accuracy moyenne : 0.8048200069228107 écart-type : 0.04139143316505894
Accuracy : 0.8126361655773421
Matrice de confusion
[[161  69]
 [ 17 212]]
Classification report
              precision    recall  f1-score   support

           0       0.90      0.70      0.79       230
           1       0.75      0.93      0.83       229

    accuracy                           0.81       459
   macro avg       0.83      0.81      0.81       459
weighted avg       0.83      0.81      0.81       459

KFold sur SVC : accuracy moyenne : 0.8842332987192801 écart-type : 0.027086735269279724
Accuracy : 0.9106753812636166
Matrice de confusion
[[216  14]
 [ 27 202]]
Classification report
              precision    recall  f1-score   support

           0       0.89      0.94      0.91       230
           1       0.94      0.88      0.91       229

    accuracy                           0.91       459
   macro avg       0.91      0.91      0.91       459
weighted avg       0.91      0.91      0.91       459

KFold sur RF : accuracy moyenne : 0.8562305295950156 écart-type : 0.022028799334427158
Accuracy : 0.8758169934640523
Matrice de confusion
[[205  25]
 [ 32 197]]
Classification report
              precision    recall  f1-score   support

           0       0.86      0.89      0.88       230
           1       0.89      0.86      0.87       229

    accuracy                           0.88       459
   macro avg       0.88      0.88      0.88       459
weighted avg       0.88      0.88      0.88       459

KFold sur LR : accuracy moyenne : 0.8543613707165107 écart-type : 0.027664972178720906
Accuracy : 0.8671023965141612
Matrice de confusion
[[192  38]
 [ 23 206]]
Classification report
              precision    recall  f1-score   support

           0       0.89      0.83      0.86       230
           1       0.84      0.90      0.87       229

    accuracy                           0.87       459
   macro avg       0.87      0.87      0.87       459
weighted avg       0.87      0.87      0.87       459

Quel classifieur choisissez-vous
:SVC
--------------------------- Optuna ---------------------------


[I 2026-04-28 15:09:01,941] A new study created in memory with name: no-name-51bb2d1b-88bf-4423-967f-78eee05b17ec
[I 2026-04-28 15:09:20,164] Trial 0 finished with value: 0.7880547707020213 and parameters: {'C': 8.2, 'gamma': 7, 'kernel': 'r213.
[I 2026-04-28 15:09:25,962] Trial 1 finished with value: 0.5255813953488373 and parameters: {'C': 9, 'gamma': 0.01, 'kernel': '[I 2026-04-28 15:09:31,707] Trial 2 finished with value: 0.5227906976744185 and parameters: {'C': 6.5, 'gamma': 8e-05, 'kernel'7020213.
[I 2026-04-28 15:09:37,574] Trial 3 finished with value: 0.5014040425994348 and parameters: {'C': 7.9, 'gamma': 1, 'kernel': 'p0213.
[I 2026-04-28 15:09:42,480] Trial 4 finished with value: 0.8506281243207997 and parameters: {'C': 0.4, 'gamma': 8e-05, 'kernel'7997.
[I 2026-04-28 15:09:48,304] Trial 5 finished with value: 0.5227906976744185 and parameters: {'C': 8.2, 'gamma': 8e-05, 'kernel'7.
[I 2026-04-28 15:09:54,591] Trial 6 finished with value: 0.8851771354053467 and parameters: {'C': 8, 'gamma': 1, 'kernel': 'rbf
[I 2026-04-28 15:10:01,107] Trial 7 finished with value: 0.8543794827211475 and parameters: {'C': 9, 'gamma': 2, 'kernel': 'lin
[I 2026-04-28 15:10:06,855] Trial 8 finished with value: 0.5227906976744185 and parameters: {'C': 0.01, 'gamma': 7, 'kernel': '7.
[I 2026-04-28 15:10:12,485] Trial 9 finished with value: 0.5237252771136709 and parameters: {'C': 9, 'gamma': 0.002, 'kernel': [I 2026-04-28 15:10:17,740] Trial 10 finished with value: 0.8833079765268419 and parameters: {'C': 6.8, 'gamma': 1, 'kernel': '3467.
[I 2026-04-28 15:10:23,229] Trial 11 finished with value: 0.8833079765268419 and parameters: {'C': 6.8, 'gamma': 1, 'kernel': '3467.
[I 2026-04-28 15:10:28,842] Trial 12 finished with value: 0.5227906976744185 and parameters: {'C': 8.3, 'gamma': 0.001, 'kernel54053467.
